{
  "vertical": "product",
  "source": "security-coverage",
  "timestamp": "2026-03-25T09:47:19Z",
  "summary": {
    "total_endpoints": 200,
    "overall_coverage": 3.1,
    "coverage": {
      "auth": 8.0,
      "idor": 2.1,
      "input": 4.5,
      "rate": 2.0,
      "jwt": 4.0,
      "cors": 0.0,
      "sensitive": 1.0
    },
    "tests_by_type": {
      "auth": {
        "covered": 16,
        "total": 200,
        "na": 0,
        "applicable": 200
      },
      "idor": {
        "covered": 4,
        "total": 200,
        "na": 5,
        "applicable": 195
      },
      "input": {
        "covered": 9,
        "total": 200,
        "na": 1,
        "applicable": 199
      },
      "rate": {
        "covered": 4,
        "total": 200,
        "na": 4,
        "applicable": 196
      },
      "jwt": {
        "covered": 8,
        "total": 200,
        "na": 0,
        "applicable": 200
      },
      "cors": {
        "covered": 0,
        "total": 200,
        "na": 8,
        "applicable": 192
      },
      "sensitive": {
        "covered": 2,
        "total": 200,
        "na": 6,
        "applicable": 194
      }
    }
  },
  "test_types": [
    "auth",
    "idor",
    "input",
    "rate",
    "jwt",
    "cors",
    "sensitive"
  ],
  "sections": {
    "<Drf Format Suffix:Format>": {
      "endpoints": [
        {
          "method": "GET",
          "path": "/api/v1/<drf_format_suffix:format>/",
          "name": "api-root",
          "auth_tested": false,
          "auth_na": false,
          "auth_na_reason": null,
          "idor_tested": false,
          "idor_na": false,
          "idor_na_reason": null,
          "input_tested": false,
          "input_na": false,
          "input_na_reason": null,
          "rate_tested": false,
          "rate_na": false,
          "rate_na_reason": null,
          "jwt_tested": false,
          "jwt_na": false,
          "jwt_na_reason": null,
          "cors_tested": false,
          "cors_na": false,
          "cors_na_reason": null,
          "sensitive_tested": false,
          "sensitive_na": false,
          "sensitive_na_reason": null
        }
      ],
      "stats": {
        "total": 1,
        "fully_covered": 0,
        "coverage_pct": 0
      }
    },
    "Activity": {
      "endpoints": [
        {
          "method": "GET",
          "path": "/api/v1/activity/<int:activity_event_id>/structured-scheduled-workout/",
          "name": "activity-structured-plan",
          "auth_tested": false,
          "auth_na": false,
          "auth_na_reason": null,
          "idor_tested": false,
          "idor_na": false,
          "idor_na_reason": null,
          "input_tested": false,
          "input_na": false,
          "input_na_reason": null,
          "rate_tested": false,
          "rate_na": false,
          "rate_na_reason": null,
          "jwt_tested": false,
          "jwt_na": false,
          "jwt_na_reason": null,
          "cors_tested": false,
          "cors_na": false,
          "cors_na_reason": null,
          "sensitive_tested": false,
          "sensitive_na": false,
          "sensitive_na_reason": null
        },
        {
          "method": "GET",
          "path": "/api/v1/activity/<int:activity_id>/",
          "name": "activity-detail",
          "auth_tested": false,
          "auth_na": false,
          "auth_na_reason": null,
          "idor_tested": false,
          "idor_na": false,
          "idor_na_reason": null,
          "input_tested": false,
          "input_na": false,
          "input_na_reason": null,
          "rate_tested": false,
          "rate_na": false,
          "rate_na_reason": null,
          "jwt_tested": false,
          "jwt_na": false,
          "jwt_na_reason": null,
          "cors_tested": false,
          "cors_na": false,
          "cors_na_reason": null,
          "sensitive_tested": false,
          "sensitive_na": false,
          "sensitive_na_reason": null
        },
        {
          "method": "GET",
          "path": "/api/v1/activity/<int:activity_id>/chart/",
          "name": "activity-chart-data",
          "auth_tested": false,
          "auth_na": false,
          "auth_na_reason": null,
          "idor_tested": false,
          "idor_na": false,
          "idor_na_reason": null,
          "input_tested": false,
          "input_na": false,
          "input_na_reason": null,
          "rate_tested": false,
          "rate_na": false,
          "rate_na_reason": null,
          "jwt_tested": false,
          "jwt_na": false,
          "jwt_na_reason": null,
          "cors_tested": false,
          "cors_na": false,
          "cors_na_reason": null,
          "sensitive_tested": false,
          "sensitive_na": false,
          "sensitive_na_reason": null
        },
        {
          "method": "GET",
          "path": "/api/v1/activity/<int:activity_id>/detailed-charts/",
          "name": "activity-detailed-charts",
          "auth_tested": false,
          "auth_na": false,
          "auth_na_reason": null,
          "idor_tested": false,
          "idor_na": false,
          "idor_na_reason": null,
          "input_tested": false,
          "input_na": false,
          "input_na_reason": null,
          "rate_tested": false,
          "rate_na": false,
          "rate_na_reason": null,
          "jwt_tested": false,
          "jwt_na": false,
          "jwt_na_reason": null,
          "cors_tested": false,
          "cors_na": false,
          "cors_na_reason": null,
          "sensitive_tested": false,
          "sensitive_na": false,
          "sensitive_na_reason": null
        },
        {
          "method": "GET",
          "path": "/api/v1/activity/<int:activity_id>/laps/",
          "name": "activity-lap-data",
          "auth_tested": false,
          "auth_na": false,
          "auth_na_reason": null,
          "idor_tested": false,
          "idor_na": false,
          "idor_na_reason": null,
          "input_tested": false,
          "input_na": false,
          "input_na_reason": null,
          "rate_tested": false,
          "rate_na": false,
          "rate_na_reason": null,
          "jwt_tested": false,
          "jwt_na": false,
          "jwt_na_reason": null,
          "cors_tested": false,
          "cors_na": false,
          "cors_na_reason": null,
          "sensitive_tested": false,
          "sensitive_na": false,
          "sensitive_na_reason": null
        },
        {
          "method": "GET",
          "path": "/api/v1/activity/<int:activity_id>/structured-workout/",
          "name": "activity-structured-workout",
          "auth_tested": false,
          "auth_na": false,
          "auth_na_reason": null,
          "idor_tested": false,
          "idor_na": false,
          "idor_na_reason": null,
          "input_tested": false,
          "input_na": false,
          "input_na_reason": null,
          "rate_tested": false,
          "rate_na": false,
          "rate_na_reason": null,
          "jwt_tested": false,
          "jwt_na": false,
          "jwt_na_reason": null,
          "cors_tested": false,
          "cors_na": false,
          "cors_na_reason": null,
          "sensitive_tested": false,
          "sensitive_na": false,
          "sensitive_na_reason": null
        }
      ],
      "stats": {
        "total": 6,
        "fully_covered": 0,
        "coverage_pct": 0
      }
    },
    "Ai": {
      "endpoints": [
        {
          "method": "GET",
          "path": "/api/v1/ai/conversations/",
          "name": "conversation_list",
          "auth_tested": true,
          "auth_na": false,
          "auth_na_reason": null,
          "idor_tested": false,
          "idor_na": true,
          "idor_na_reason": "Endpoint automatically filters by authenticated user",
          "input_tested": false,
          "input_na": true,
          "input_na_reason": "No user input accepted (no query parameters)",
          "rate_tested": false,
          "rate_na": true,
          "rate_na_reason": "Read-only list endpoint - minimal abuse potential",
          "jwt_tested": true,
          "jwt_na": false,
          "jwt_na_reason": null,
          "cors_tested": false,
          "cors_na": true,
          "cors_na_reason": "CORS configured globally in Django settings",
          "sensitive_tested": true,
          "sensitive_na": false,
          "sensitive_na_reason": null
        },
        {
          "method": "DELETE",
          "path": "/api/v1/ai/conversations/<int:conversation_id>/",
          "name": "conversation_delete",
          "auth_tested": true,
          "auth_na": false,
          "auth_na_reason": null,
          "idor_tested": true,
          "idor_na": false,
          "idor_na_reason": null,
          "input_tested": true,
          "input_na": false,
          "input_na_reason": null,
          "rate_tested": false,
          "rate_na": true,
          "rate_na_reason": "Deletion of own resource - low abuse potential",
          "jwt_tested": true,
          "jwt_na": false,
          "jwt_na_reason": null,
          "cors_tested": false,
          "cors_na": true,
          "cors_na_reason": "CORS configured globally in Django settings",
          "sensitive_tested": false,
          "sensitive_na": true,
          "sensitive_na_reason": "Delete operation - no data returned"
        },
        {
          "method": "GET",
          "path": "/api/v1/ai/conversations/<int:conversation_id>/messages/",
          "name": "conversation_messages",
          "auth_tested": true,
          "auth_na": false,
          "auth_na_reason": null,
          "idor_tested": true,
          "idor_na": false,
          "idor_na_reason": null,
          "input_tested": true,
          "input_na": false,
          "input_na_reason": null,
          "rate_tested": false,
          "rate_na": true,
          "rate_na_reason": "Read-only endpoint - minimal abuse potential",
          "jwt_tested": true,